id,user,created_at,lang,full_text
737693181366665216,mujibshami1,Tue May 31 17:12:14 +0000 2016,ur,کسی کی بیماری کو انجوائے کرنااوراس پرسیاست کرناکوئی مناسب رویہ نہیں، ایسےلوگوں کوذمہ داری سےبات کرنی چاہیے اورکسی کا دل نہیں دکھانا چاہیے3/4
737692973853478917,mujibshami1,Tue May 31 17:11:25 +0000 2016,ur,پی ٹی آئی کی ایک سینئررہنما نے ٹویٹ کیا کہ وزیراعظم کی بیماری اتنی سنگین نہیں، مریم محض لوگوں کی ہمدری کے لیے بڑھا چڑھا کر پیش کر رہی ہیں2/4
737692839145013249,mujibshami1,Tue May 31 17:10:53 +0000 2016,ur,حیرت ہےکہ سوشل میڈیا پرلوگ وزیراعظم کےآپریشن کولے کربھی بھانت بھانت کی باتیں بناتے رہے جن میں کچھ پی ٹی آئی کے اعلیٰ عہدیداربھی شامل ہیں1/4
737342979006967808,mujibshami1,Mon May 30 18:00:40 +0000 2016,ur,2/2دنیابھرمیں پارلیمانی نظام میں قائم مقام وزیراعظم نہیں بنایاجاتا، اس نظام میں وزیراعظم باہرجاتاہےتوان کی پوری کابینہ ملک میں موجودہوتی ہے
737342370522501120,mujibshami1,Mon May 30 17:58:14 +0000 2016,ur,افتخار چوہدری نے قائم مقام وزیراعظم بنانےکی بات کردی ہے، مجھےان پرحیرت ہوتی ہےکہ یہ چیف جسٹس بھی رہے ہیں جنہوں نے ملکی آئین بھی نہیں پڑھا1/2
737339595550019584,mujibshami1,Mon May 30 17:47:13 +0000 2016,ur,رسول اللہ نےفرمایاہےکہ دعاکےسواکوئی عمل ایسانہیں جوتقدیربدل سکے، یعنی دعا تقدیربھی بدل سکتی ہے اوراسی یقین کےساتھ ہم وزیراعظم کےلیےدعاگو ہیں
737337980759748608,mujibshami1,Mon May 30 17:40:48 +0000 2016,ur,اس وقت وزیراعظم کےمخالفین بھی ان کےلیےدعاکررہے ہیں، یہی ہمارےمعاشرےکاحسن ہے، جب عمران خان کوچوٹ لگی تھی تب وزیراعظم نےبھی یہی جذبہ دکھایاتھا
737336686926041089,mujibshami1,Mon May 30 17:35:39 +0000 2016,ur,وزیراعظم صاحب کا کل آپریشن ہونے جا رہا ہے، ہماری دعائیں ان کے ساتھ ہیں، اللہ تعالیٰ انہیں جلد صحتیاب کرے اور وہ بخیروعافیت وطن واپس لوٹیں
736830022787444736,mujibshami1,Sun May 29 08:02:21 +0000 2016,ur,5/5 پہلےبھی ایسی باتیں کی جاتی رہی ہیں، مخالفین کومشورہ ہےکہ الزام لگانےسےپہلےتحقیق کرلیاکریں،کسی کےنظریات پرغصےکےاظہارکایہ طریقہ مناسب نہیں
736828949888684032,mujibshami1,Sun May 29 07:58:05 +0000 2016,ur,جولوگ قاسمی صاحب کوذاتی طورپرجانتےہیں وہ تصدیق کرسکتےہیں کہ ان کےنقطہ نظرسےاختلاف توکیاجاسکتاہے لیکن ان کےکردارپرکیچڑ نہیں اچھالا جا سکتا4/5
736828414070554624,mujibshami1,Sun May 29 07:55:58 +0000 2016,ur,شائع شدہ خبرمیں اس طرف بھی اشارہ کیا گیا ہےکہ قاسمی صاحب نےدانشوروں کےنام پررقم خودرکھ لی ہے، میرےعلم کےمطابق یہ بات بھی بالکل بےبنیادہے3/5
736827820039626752,mujibshami1,Sun May 29 07:53:36 +0000 2016,ur,خبرکےمطابق مجھےبھی اظہارخیال کےلیے10لاکھ روپےدیئے گئے جوسراسربے بنیاداورغلط ہے، میں نےکبھی کسی تقریب میں شرکت کیلئےکوئی رقم قبول نہیں کی 2/5
736827198926127104,mujibshami1,Sun May 29 07:51:08 +0000 2016,ur,ایک ویب سائٹ پردعویٰ کیاگیاہےکہ عطاءالحق قاسمی نےایک کانفرنس میں شرکت کےلیےچنددانشوروں کوپنجاب حکومت کےخرچ پرساڑھے4کروڑ روپے ادا کیے ہیں1/5
736818156103028738,mujibshami1,Sun May 29 07:15:12 +0000 2016,ur,"""نواز شریف کا دل""
میرا آج کا کالم ملاحظہ فرمائیں
https://t.co/O4XC6liRVR"
735896223715078145,mujibshami1,Thu May 26 18:11:46 +0000 2016,ur,"سندھ حکومت کےمختلف عناصرکراچی آپریشن میں تعاون نہیں کررہے، یہاں کئی فریق اورسب کےاپنے""مسائل""
ایک سب آگ، ایک سب پانی
دیدہ و دل عذاب ہیں دونوں"
735895165072707589,mujibshami1,Thu May 26 18:07:34 +0000 2016,ur,"2/2وزیرداخلہ سندھ نے بھی وہ رپورٹ آئی جی کودکھانی ضروری نہیں سمجھی اور""متعلقہ"" افراد کو واٹس ایپ کر دی، پھر اس میں ""ضروری"" قطع و برید کی گئی"
735894906699448324,mujibshami1,Thu May 26 18:06:32 +0000 2016,ur,اندرکی بات سنیے،عزیربلوچ کیس کی جےآئی ٹی رپورٹ آئی جی تک پہنچانےکےلیےایک پولیس افسرکودی گئی اس نےوہ آئی جی کی بجائےوزیرداخلہ سندھ کودے دی1/2
735892178002714624,mujibshami1,Thu May 26 17:55:42 +0000 2016,ur,کراچی کےمعاملےمیں حکومت اورعدلیہ اپناکردارادانہیں کرپارہیں،6500لوگ پکڑےگئےتھےان میں سےاڑھائی ہزارتک ضمانت پررہاہوچکے،صرف170تک کوسزاہوپائی ہے
735890939307294720,mujibshami1,Thu May 26 17:50:46 +0000 2016,ur,کراچی کے حالات مزید بہتر بنانے کے لیے حکومت، فوج اور رینجرز کا باہمی تعاون طویل عرصے تک جاری رکھنا پڑے گا تب کہیں پائیدار امن ممکن ہو سکے گا
735889737609793536,mujibshami1,Thu May 26 17:46:00 +0000 2016,ur,کل کراچی میں کچھ دوستوں نے بتایا کہ کراچی کے حالات فاٹا سے بھی بدتر ہیں، یہاں سے ایسا خطرناک اسلحہ برآمد ہو رہا ہے جو کبھی فاٹا سے نہیں ہوا
735887358466371584,mujibshami1,Thu May 26 17:36:33 +0000 2016,ur,ہمیں تمام شناختی کارڈزکی ازسرنوچیکنگ اورافغان مہاجرین کی سکروٹنی کرنی چاہیےمگرہرمہاجرکوتخریب کارکہہ کردھکےدےکرنکالنےکی دھمکی نہیں دینی چاہیے
735885559353225217,mujibshami1,Thu May 26 17:29:24 +0000 2016,ur,افغان مہاجرین میں ہرشخص تخریب کارنہیں، خودکچھ پاکستانی بھی توایسے ہیں، سب کوایک لاٹھی سے ہانکنے کی بجائےان کی باعزت واپسی کی سبیل کرنی چاہیے
735885144305893376,mujibshami1,Thu May 26 17:27:45 +0000 2016,ur,ایک اندازہ ہے کہ12لاکھ تک اَن رجسٹرڈافغانی ہیں، اگرچہ انہیں ایک دن واپس جانا ہی ہے مگرمسئلہ یہ ہے کہ جو یہاں پیداہوئے وہ پاکستانی ہو چکے ہیں
735884732735627264,mujibshami1,Thu May 26 17:26:07 +0000 2016,ur,اس وقت پاکستان میں15لاکھ رجسٹرڈ افغان مہاجرہیں، اقوام متحدہ ان کے کھانے و دیگر انتظامات کے لیے فی کس 78 ڈالر یعنی 7800روپے سالانہ دیتی ہے
735881446452269058,mujibshami1,Thu May 26 17:13:03 +0000 2016,ur,پہلے بھارتی نیٹ ورک بے نقاب کیا، آج افغانی ایجنٹ پکڑے گئے، محدود وسائل کے باوجود بہترین کارکردگی پر ہمارے سکیورٹی ادارے مبارکبادکے مستحق ہیں
735536505469448192,mujibshami1,Wed May 25 18:22:23 +0000 2016,ur,ملامنصورکے جعلی کارڈ کو لے کرچوہدری نثارکل نادرا پر خوب برسے حالانکہ وہ خود نادرا کے انچارج ہیں، اس پر تنقید کرکے خود بری الذمہ نہیں ہو سکتے
735535566729707520,mujibshami1,Wed May 25 18:18:39 +0000 2016,ur,ڈرون حملوں کےپس منظرمیں ہمیں اپنی بات کرتےہوئےدنیاکی سننی بھی پڑےگی اوراپنےاداروں کی کارکردگی کےباعث جوخجالت ہورہی ہےاس کاسدباب بھی کرناہوگا
735534338415206400,mujibshami1,Wed May 25 18:13:46 +0000 2016,ur,ہمارے شکوے اورتحفظات اپنی جگہ، جب ملامنصور محمدولی کے روپ میں پاکستانی پاسپورٹ پر418 بار پاکستان آیا اورگیا، اس پردنیا ہم سے سوال توپوچھے گی
735533140094115840,mujibshami1,Wed May 25 18:09:00 +0000 2016,ur,ملامنصوراخترکے شناختی کارڈکولے کرنادرا کی کارکردگی پرسنگین سوال اٹھ رہے ہیں، یہ معاملہ پاکستان پر بیرونی دنیا کے دباؤ کا باعث بھی بن سکتا ہے
735531285767200768,mujibshami1,Wed May 25 18:01:38 +0000 2016,ur,افغآنستان میں ملا فضل اللہ جیسے لوگ موجود ہیں جو پاکستان میں معصوم لوگوں کو موت کے گھاٹ اتارتے ہیں، امریکہ کے ڈرونز کو وہ نظر کیوں نہیں آتے؟
735529393544663040,mujibshami1,Wed May 25 17:54:07 +0000 2016,ur,پارلیمانی کمیٹی کوقوم کویہ تاثردیناچاہیےکہ اس کےیہ لیڈرچھوٹےچھوٹےنکات میں الجھ کروقت ضائع نہیں کررہے بلکہ بڑےنکات کوحل کرنے کی سعی کررہے ہیں
735528458730778624,mujibshami1,Wed May 25 17:50:24 +0000 2016,ur,پارلیمانی کمیٹی اب بھی چیئرمین شپ کاکوئی حل نکال سکتی ہے اگران کی نیت درست ہواوریہ قوم کواحتساب کےمعاملے میں اپنی سنجیدگی کاتاثردیناچاہیں تو
735527859121467397,mujibshami1,Wed May 25 17:48:01 +0000 2016,ur,جب کوئی کمیٹی بنتی ہے تونظم وضبط برقراررکھنےکےلیےکوئی تواس کاسربراہ ہوتاہے، ٹی اوآرزکمیٹی کے 2چیئرمین منتخب کرلیں جوباری باری صدارت کرتےرہیں
735526430482780160,mujibshami1,Wed May 25 17:42:21 +0000 2016,ur,اشتراکی ممالک میں ایک سےزائدصدورہوتےہیں جن کےلیےPresidiumکالفظ استعمال ہوتاہے،اسی طرح کمیٹی کےبھی2 چیئرمین بنالیےجاتےتوان کاکچھ بھرم رہ جاتا
735524322580832256,mujibshami1,Wed May 25 17:33:58 +0000 2016,ur,فریقین میں تلخی جب اس نہج پرہوکہ ٹی اوآرزکےلیے قائم پارلیمانی کمیٹی کاچیئرمین بھی نہ بناسکیں تواس سے معاملات کی نوعیت کااندازہ لگایاجاسکتاہے
735176899299680258,mujibshami1,Tue May 24 18:33:26 +0000 2016,ur,چوہدری نثارآج شاعرانہ بات کہی کہ ڈرون طیارہ پاکستان سے کنٹرول نہیں ہو رہا تھا: جہاں سے بھی ہورہا تھا اس کا نشانہ تو پاکستان کی سرزمین بنی ہے
735173526366375936,mujibshami1,Tue May 24 18:20:02 +0000 2016,ur,پیپلزپارٹی والےجوباتیں کررہےہیں ان کاسیاست پراثرتوہوگامگران کی یہ بات مبالغہ ہےکہ اب سب کچھ ان کے ہاتھ میں ہےاورصرف وہی مسئلہ حل کر سکتے ہیں
735172204615237632,mujibshami1,Tue May 24 18:14:47 +0000 2016,ur,اب یہ سوال خارج از بحث ہے کہ وزیراعظم کی آصف زرداری سے ملاقات ہوئی یا نہیں، مولانا فضل الرحمان کی ملاقات ہو گئی تو سمجھیں وزیراعظم کی ہو گئی
735171810099113984,mujibshami1,Tue May 24 18:13:13 +0000 2016,ur,پیپلزپارٹی پانامہ کامعاملہ اپنی طاقت کی بحالی کےلیےاستعمال کررہی ہے، حکومت پردباؤبھی بڑھارہی ہےاور مسئلےکاحل بھی آصف زرداری کے پاس بتارہی ہے
734810052910055424,mujibshami1,Mon May 23 18:15:43 +0000 2016,ur,2/2 مولانا صاحب لندن میں کوئی پل ضرور بنائیں گے مگر اس پر وہ خود نہیں چڑھیں گے کیونکہ اس سے پل ٹوٹ سکتا ہے، وہ دوسروں کی ٹریفک رواں کر یں گے
734809346060734464,mujibshami1,Mon May 23 18:12:54 +0000 2016,ur,1/2 وزیراعظم اور آصف زرداری لندن میں ہیں، ایسے میں مولانا فضل الرحمان کی بھی لندن میں موجودگی حکومت کے مخالفین کے لیے خطرے سے خالی نہیں ہے
734806517543735296,mujibshami1,Mon May 23 18:01:40 +0000 2016,ur,"کس کا یقین کیجیے، کس کا یقیں نہ کیجیے
لائے ہیں بزمِ ناز سے، لوگ خبر الگ الگ"
734799333548273664,mujibshami1,Mon May 23 17:33:07 +0000 2016,ur,بلوچستان میں ہوئے ڈرون حملے نے ملکی خودمختاری پرسنجیدہ سوال اٹھا دیئے ہیں، حکمرانوں اوردفاعی اداروں کوان کا جواب دے کرقوم کومطمئن کرنا چاہیے
734798419961712641,mujibshami1,Mon May 23 17:29:29 +0000 2016,ur,2/2مگرہم چپ سادھے بیٹھے ہیں، زبردست مارے اوررونے بھی نہ دے والی کیفیت بنی ہوئی ہے، اس پرہم اگردل نہیں پکڑسکتے تو سرپکڑ کر ضرور بیٹھنا چاہیے
734798183235194880,mujibshami1,Mon May 23 17:28:33 +0000 2016,ur,حالیہ ڈرون حملہ پہلاہےجوقبائلی علاقے سے باہرہوا، ملکی خودمختاری کی اس صریح خلاف ورزی پرقوم، حکومت اورفوج کی طرف سےسخت احتجاج ہوناچاہیےتھا1/2
734795475522584576,mujibshami1,Mon May 23 17:17:47 +0000 2016,ur,آزادکشمیرکےووٹرزسےعمران خان کرپشن ختم کرنےکاوعدہ کررہے تھے، وہ پوچھیں گےکہ جہاں آپ کی حکومت ہےوہاں ختم ہوگئی؟ یہ کرنےکی بات ہے، کہنےکی نہیں
734794325788360704,mujibshami1,Mon May 23 17:13:13 +0000 2016,ur,عمران خان کی ملک کوکرپشن سے پاک کرنے کی بات درست، مگربصدادب عرض ہے کہ کےپی کے میں ان کی حکومت نےجوپاکیزگی پیداکی ہےکیااسی کومثال بنالیاجائے؟
733543150229159936,mujibshami1,Fri May 20 06:21:30 +0000 2016,ur,پنجاب اورسندھ کی صوبائی حکومتوں نےبجٹ میں مقامی حکومتوں کے لیے رقم مختص ہی نہیں کی، لگتا ہے یہ اختیارات ہی نچلی سطح پرمنتقل نہیں کرنا چاہتیں
733357403450834944,mujibshami1,Thu May 19 18:03:24 +0000 2016,ur,اراکین اسمبلی کی تنخواہیں بڑھنے پر بہت شور اٹھ رہا ہے، میں تو کہتا ہوں کہ اگر یہ صرف تنخواہ پر گزارہ کریں تو مزید بڑھانے میں بھی مضائقہ نہیں
733350407980875778,mujibshami1,Thu May 19 17:35:36 +0000 2016,ur,جب حکومت اوراپوزیشن جوڈیشل کمیشن پرمتفق ہوگئی ہیں تو اب انہیں جلسوں میں تنقید کرنے کی بجائے کمیشن کے سامنے اپنے الزامات سچ ثابت کرنے چاہئیں
733349629123821574,mujibshami1,Thu May 19 17:32:31 +0000 2016,ur,عمران خان کی تجویزپرکمیشن بنانے پراتفاق ہوگیا، ٹی اوآرزطےکرنےکےلیےکمیٹی بن گئی، اب انہیں پانامہ پیپرزکےمعاملے پرالزامات لگانےسےگریزکرناچاہیے
733340452066365441,mujibshami1,Thu May 19 16:56:03 +0000 2016,ur,حکومت کوبھی خیال کرناچاہیےکہ سڑکوں کےساتھ عوام کوصحت اورتعلیم کی سہولیات بھی دے اورمخالفین کو بھی تعمیری منصوبوں پر تنقید سے گریز کرنا چاہیے
733340092933263361,mujibshami1,Thu May 19 16:54:37 +0000 2016,ur,صحت و تعلیم کی سہولیات کی فراہمی بھی ازحد ضروری ہے مگر سڑکیں بھی ملکی ترقی کا پہلا زینہ ہوتی ہیں، ان کی تعمیر پر اعتراض بھی بلاجواز ہے
731735578824331264,mujibshami1,Sun May 15 06:38:51 +0000 2016,ur,سول و ملٹری قیادت کو سمجھنا ہوگا کہ کسی گاڑی کو بیک وقت دو ڈرائیور چلا سکتے ہیں نہ کنڈکٹر کو سٹیرنگ پر بیٹھنے کی اجازت دی جا سکتی ہے
731735494053232640,mujibshami1,Sun May 15 06:38:31 +0000 2016,ur,پاکستان میں سول ملٹری تعلقات کی اپنی تاریخ ہے، وقت آ گیا ہے کہ دونوں اپنے اپنے گریبان میں مُنہ ڈالیں بلکہ ڈالے رکھیں، تماشا بنیں نہ بنائیں
731735030372937732,mujibshami1,Sun May 15 06:36:40 +0000 2016,ur,ہمارے جمہوری نظام میں یہ سکت اور صلاحیت ہونی چاہئے کہ وہ کالے کو کالا کہہ سکے اور اس کی گرفت بھی کر سکے
731734697148026880,mujibshami1,Sun May 15 06:35:21 +0000 2016,ur,کل قومی اسمبلی کااجلاس حکومت اوراپوزیشن کاامتحان ہوگاکہ دونوں میں پانامہ بحران سےنبٹنےکی صلاحیت ہےیانہیں،زچ کرنےکی ساست سےکسی کابھلا نہ ہوگا
731731404900450304,mujibshami1,Sun May 15 06:22:16 +0000 2016,ur,پانامہ کاہنگامہ اٹھا توآف شورکمپنیاں یکسرحرام قراردی گئیں،اب عمران خان کی کمپنی سامنےآنےپرجائزکمائی سےبننےوالی کمپنیاں حلال قراردےدی گئی ہیں
731727716874096641,mujibshami1,Sun May 15 06:07:37 +0000 2016,ur,فارن کرنسی اکاؤنٹس کی وجہ زرِمبادلہ کےذخائرمیں اضافہ بتائی گئی جسے جھٹلانا بھی مشکل تھا، مگر ان کے طفیل حرام خوررندکےرندرہےاورجنت پربھی پالی
731726028545069056,mujibshami1,Sun May 15 06:00:54 +0000 2016,ur,پاکستانیوں نےایک زمانےمیں اپنےبنکوں ہی میں آف شوراکاؤنٹ(فارن کرنسی اکاؤنٹ)کھول لیےتھے،یہ سہولت نوازحکومت نےدی تھی، مقصدکچھ تھانتیجہ کچھ نکلا
731723655932186624,mujibshami1,Sun May 15 05:51:28 +0000 2016,ur,باقی ممالک کی آف شورکمپنیوں کا معاملہ سوئٹزرلینڈ کے بینکوں جیسا ہی ہے جو دنیا بھرکے حرام خوروں کی کمائی چھپانے کے لیے محفوظ جنت بنے ہوئے ہیں
731723074178043904,mujibshami1,Sun May 15 05:49:10 +0000 2016,ur,ترقی یافتہ ممالک نے قصداً آف شور کمپنیوں کو سہولیات دے رکھی ہیں تاکہ اپنی معیشت کو فروغ دے سکیں اور دنیا بھرکا مشکوک سرمایہ اپنے ہاں لا سکیں
731718877533601792,mujibshami1,Sun May 15 05:32:29 +0000 2016,ur,"میرا آج کا کالم ""ولدّیت کے بغیر سرمایہ"" ملاحظہ فرمائیں
https://t.co/iuhOmcM8St"
731109936621555713,mujibshami1,Fri May 13 13:12:46 +0000 2016,ur,سپریم کورٹ کے خط کی روشنی میں حکومت اوراپوزیشن کو مذاکرات کے ذریعے درکار قانون سازی کرنی چاہئے تاکہ معاملہ آگے بڑھ سکے
730830906127228928,mujibshami1,Thu May 12 18:44:00 +0000 2016,ur,"میں جومہکا تومری شاخ جلادی اس نے
سبزموسم میں مجھےزرد ہوادی اس نے
پہلےاک لمحےکی زنجیرسےباندھامجھ کو
اورپھروقت کی رفتاربڑھادی اس نے
افتخارعارف"
730827759233142784,mujibshami1,Thu May 12 18:31:30 +0000 2016,ur,3/3اگراپوزیشن صرف وزیراعظم کےاحتساب پربضدرہی تووقت کے ضیاع کےسواکچھ ہاتھ نہ آئےگا، انہیں تمام پانامہ زدگان کی تحقیقات کی راہ ہموارکرنی چاہیے
730826847928324096,mujibshami1,Thu May 12 18:27:53 +0000 2016,ur,میرا مطمع نظر صرف  یہ ہے کہ اپوزیشن اور حکومت اپنی اپنی ڈفلی بجانے کی بجائے ٹی او آرزسمیت تمام معاملات سپریم کورٹ کے ذمے ڈال دیں 2/3
730826725895081984,mujibshami1,Thu May 12 18:27:24 +0000 2016,ur,میں جب بھی پانامہ لیکس پر بات کرتاہوں تو لوگ کہتے ہیں کہ میں وزیراعظم کی طرفداری کر رہا ہوں، حالانکہ میں تو سپریم کورٹ کے ساتھ کھڑا ہوں 1/3
730824955726835712,mujibshami1,Thu May 12 18:20:22 +0000 2016,ur,اپوزیشن وزیراعظم کواسمبلی میں جواب دینےکےلیےکہہ رہی ہے،وہاں تووزیراعظم کےپاس اکثریت ہے،اپوزیشن کی تحریک فوری مستردہوجائےگی، پھرکیاکریں گےیہ؟
730819876919595008,mujibshami1,Thu May 12 18:00:11 +0000 2016,ur,طاقت کاامتحان یہ ہےکہ استعمال نہ کی جائے، جس نےطاقت استعمال کی یہ اس کی کمزوری بن گئی،اس کےاستعمال کی دھمکی خوداس سےزیادہ طاقتورہوتی ہے(End)
730819068601761792,mujibshami1,Thu May 12 17:56:58 +0000 2016,ur,محبت اور تسلی کا آپس میں گہرا تعلق ہوتا ہے،محبت بہانے ڈھونڈتی ہے کہ کوئی اسے تسلی دے، مگر طاقت کی دنیا میں محبت ہوتی ہے نہ تسلی (Cont)
730816893146304514,mujibshami1,Thu May 12 17:48:19 +0000 2016,ur,"دوحرف تسلی کے، جس نے بھی کہے، اس کو
افسانہ سنا ڈالا، تصویر دکھا ڈالی
ڈاکٹر خورشید رضوی
(Cont)"
730816607166042113,mujibshami1,Thu May 12 17:47:11 +0000 2016,ur,لفظ تسلی بھی بڑاعجیب ہے، بعض اوقات ہماری تسلی ہوتی ہے، بسااوقات ہم تسلی دیتےہیں، مگرتسلی دینےسےبات بنتی نہیں،کچھ تشنگی باقی رہ جاتی ہے(Cont)
730812226555265024,mujibshami1,Thu May 12 17:29:47 +0000 2016,ur,3/3جب پاکستان کےماضی پرنظرڈالتاہوں تودل دکھتا ہے،سوچتا ہوں ملک کامستقبل کچھ مختلف ہوناچاہیے،جواپنی غلطی کی اصلاح پرآمادہ ہواسےموقع دیناچاہیے
730811604028272646,mujibshami1,Thu May 12 17:27:18 +0000 2016,ur,2/3الطاف حسین کی طاقت پاکستان کےحق میں استعمال ہوسکتی ہے، انہیں دیوارسےلگانےکی بجائے ان کی طاقت کو پاکستان کے حق میں لانے کی کوشش کرنی چاہیے
730811398402527233,mujibshami1,Thu May 12 17:26:29 +0000 2016,ur,تمام ترمثبت ومنفی باتوں کےباوجودایم کیوایم ایک سیاسی حقیقیت ہےاورالطاف حسین کی پارٹی پرپوری گرفت ہے، انہیں اصلاح کا موقع ضرورملناچاہیے1/3
730467226533367809,mujibshami1,Wed May 11 18:38:52 +0000 2016,ur,آج یوسف رضاگیلانی نےبیٹےسےملنےکی بجائےعدالت میں پیش ہوکرہم جیسوں کےمنہ پرطمانچہ ماراہےکہ سیاستدان لاکھ برےہوں مگرقانون کو بالادست سمجھتے ہیں
730462522520801284,mujibshami1,Wed May 11 18:20:11 +0000 2016,ur,2/2ہم ان کا ساتھ نہ دے کرلوگوں کوکیاپیغام دےرہےہیں کہ خدانخواستہ آئندہ پاکستان کےکسی حصےمیں ایسی آگ بھڑکے تو لوگ پاکستان کی طرف پیٹھ کر دیں؟
730462067019399169,mujibshami1,Wed May 11 18:18:22 +0000 2016,ur,جنہیں آج بنگلہ دیشی حکومت قتل کررہی ہےیہ لوگ مشرقی پاکستان کی بغاوت کےوقت پاکستان اورپاکستانی فوج کےساتھ کھڑےرہے، آج وہ اس کی سزاپارہےہیں1/2
730460432973074432,mujibshami1,Wed May 11 18:11:53 +0000 2016,ur,بنگلہ دیش میں عدالتی کارروائی کاڈھونگ رچاکرجماعت اسلامی کے رہنماؤں کوقتل کیاجا رہا ہے، اس پر پاکستان کو عالمی عدالت انصاف میں جانا چاہیے تھا
730459846005411840,mujibshami1,Wed May 11 18:09:33 +0000 2016,ur,بنگلہ دیش میں جماعت اسلامی کےسابق امیرمطیع الرحمن نظامی کوبھی پھانسی دےدی گئی،افسوس جب ان پرکیس چل رہاتھاحکومت پاکستان نےاپنافرض ادانہیں کیا
730457061486678016,mujibshami1,Wed May 11 17:58:29 +0000 2016,ur,اگراپوزیشن واقعی احتساب چاہتی ہےتوحکومتی ٹی اوآرزمیں موجودکرپشن کرنےاورقرضےمعاف کرانےوالوں کےاحتساب کی شق اپوزیشن نےاپنےٹی اوآرزسےکیوں نکالی
730454115223019520,mujibshami1,Wed May 11 17:46:46 +0000 2016,ur,وزیراعظم عوامی لیڈرہیں، ان سےہربات پوچھی جاسکتی ہےاوروہ جواب دینےکےپابندہیں لیکن ہروقت، ہرجگہ انہیں نہیں پوچھاجاسکتا،ہربات کاکوئی محل ہوتاہے
