id,user,created_at,lang,full_text
829013216705523712,mujibshami1,Tue Feb 07 17:05:27 +0000 2017,ur,الطاف حسین کےریڈوارنٹ جاری ہوگئےمگربرطانیہ کےساتھ ہمارا ملزموں کےتبادلےکا کوئی معاہدہ نہیں ہے، مقدمہ چلےتوسزا غیرحاضری میں بھی دی جا سکتی ہے
828653079272759296,mujibshami1,Mon Feb 06 17:14:24 +0000 2017,ur,اشفاق احمد اپنی مثال آپ تھے اور بانو قدسیہ اپنی مثال آپ، یہ ایک بے مثال جوڑا تھا، محبتیں اور آسانیاں بانٹنے والا، اللہ انہیں غریقِ رحمت کرے
828649027126304768,mujibshami1,Mon Feb 06 16:58:18 +0000 2017,ur,بھارت کےبےانتہامظالم نےکشمیریوں کوبےخوف کردیا ہےاورجوقوم بےخوف ہوجائےاس کی تحریک کوکامیاب ہونے سے کوئی نہیں روک سکتا، کشمیری جلد سرخروہوں گے
828647885843681284,mujibshami1,Mon Feb 06 16:53:46 +0000 2017,ur,مقبوضہ کشمیرمیں تاریخ کی سب سےبڑی تحریک چل رہی ہے، ظلم کےپہاڑتوڑےجارہےہیں، بچوں کی آنکھیں نوچی جا رہی ہیں مگر ان کا جذبہ آزادی سردنہیں ہورہا
828644002362712066,mujibshami1,Mon Feb 06 16:38:20 +0000 2017,ur,پرویز مشرف سے کئی جماعتوں کے رہنما مل چکے ہیں، کچھ کھچڑی تو پک رہی ہے، اب انہیں چاہیے کہ نعرہ تکبیر لگا کر واپس آ جائیں
828643196641112069,mujibshami1,Mon Feb 06 16:35:08 +0000 2017,ur,پرویز مشرف پاکستان آ نہیں سکتےکہ کئی مقدمے ان کے منتظر ہیں ورنہ ان میں قیادت کی آرزو بہت مچل رہی ہے اور ایک اتحاد بنانے کی کوششیں کر رہے ہیں
828641177205403650,mujibshami1,Mon Feb 06 16:27:06 +0000 2017,ur,پی ایس پی نےکہہ دیاکہ سلیم شہزاداس میں شامل نہیں ہورہے،افواہ ہےمتحدہ پاکستان میں جائیں گے،لوگ تویہ بھی کہہ رہےہیں کہ آخریہ سب ایک ہوجائیں گے
828233990154895361,mujibshami1,Sun Feb 05 13:29:05 +0000 2017,ur,"""شہباز سپیڈ""  آج کا کالم https://t.co/khRONEnljG"
827208576372465665,mujibshami1,Thu Feb 02 17:34:28 +0000 2017,ur,پنجاب کےسپیشل مانیٹرنگ یونٹ نےاپنے2سالہ اخراجات کی تفصیل جاری کردی ہے، اگرسبھی محکمےاس کی پیروی کریں توکرپشن کامسئلہ بہت حد تک ختم ہوسکتا ہے
827205677777027074,mujibshami1,Thu Feb 02 17:22:56 +0000 2017,ur,تماشا دیکھیے،امریکہ نے7مسلم ملکوں پرپابندی لگائی اوراس کےخلاف امریکہ اوریورپ میں ہی مظاہرےہو رہےہیں،مسلم ملک منہ میں گھنگنیاں ڈال کربیٹھےہیں
827204518198771712,mujibshami1,Thu Feb 02 17:18:20 +0000 2017,ur,اللہ کے فضل سے نیب سےتمام سیاسی جماعتیں جان چھڑانا چاہتی ہیں، اب یہ طےہورہا ہے کہ اسے ذبح کرنا ہے، جھٹکا دینا ہے یا اس پرخود کش حملہ کرنا ہے
827202657521647616,mujibshami1,Thu Feb 02 17:10:56 +0000 2017,ur,چیئرمین نیب آئینی عہدہ ہے، اسےبرخاست کرنےکاوہی طریقہ ہےجوسپریم کورٹ کے ججوں کوبرخاست کرنے کا ہے مگرجس کاجی چاہتا ہےاسےچار ٹھاپیں لگا دیتا ہے
827201374446288897,mujibshami1,Thu Feb 02 17:05:50 +0000 2017,ur,چیئرمین نیب کاعہدہ توغریب کی جوروہوگئی جوسب کی بھابھی ہوتی ہے، سیاستدان اس کےدرپے،عدلیہ کی ڈانٹ ڈپٹ اس کو،اب شایدکوئی یہ عہدہ قبول ہی نہ کرے
827198363158315008,mujibshami1,Thu Feb 02 16:53:53 +0000 2017,ur,کراچی میں ایم کیوایم کاکردارسامنےآچکا،اس کےمقابلےکےلیےپیپلزپارٹی نےبھی فورس بنائی،دولت وطاقت حاصل کرنےکےاس آسان طریقےنےکئی بابالاڈلہ پیداکیے
827196412421144579,mujibshami1,Thu Feb 02 16:46:07 +0000 2017,ur,جب ملک میں قانون کی حاکمیت نہیں ہوتی، بچوں کوتعلیم اورروزگارنہیں ملتا تب نوجوان مجرموں کےہتھے چڑھتے ہیں اور بابا لاڈلہ جیسے مجرم بن جاتے ہیں
826479146930991105,mujibshami1,Tue Jan 31 17:15:58 +0000 2017,ur,وزیرداخلہ کو بلاگر کے متعلق وضاحت ضرور کرنی چاہیے کہ یہ کہاں تھے؟ انہیں کس نے پکڑا، کیوں پکڑا اور پھر چھوڑا کیوں گیا؟ یہ معلوم ہونا چاہیے
826477562029338625,mujibshami1,Tue Jan 31 17:09:40 +0000 2017,ur,فوج کویہ بات سمجھنی چاہیےکہ وہ حکومت کےمتحارب طاقت نہیں،حکومت کوبھی سمجھناچاہیےکہ فوج اسکابازوئےشمشیرزن ہے،ہاتھ کبھی منہ کامخالف نہیں ہوسکتا
826475554064973828,mujibshami1,Tue Jan 31 17:01:41 +0000 2017,ur,میڈیا کےکچھ عناصرہروقت حکومت اورفوج کو لڑانےکی کوشش میں لگےرہتےہیں، یہ لوگ ذاتی خواہشات کوکبھی حکومت اورکبھی فوج کی خواہشات بناکرپیش کرتےہیں
826472881001525248,mujibshami1,Tue Jan 31 16:51:04 +0000 2017,ur,پاکستان تواقدام کررہاہے، اب بھارت کوبھی سوچناچاہیے، اس کےجاسوس بھی یہاں پکڑےجارہےہیں اورنان سٹیٹ ایکٹریہاں کام کررہےہیں،وہ بھی یہ سلسلہ روکے
826470793286656000,mujibshami1,Tue Jan 31 16:42:46 +0000 2017,ur,جماعۃ الدعوۃ کےمتعلق اگرریاستی اداروں نےمتفقہ فیصلہ کیا ہےتوظاہرہے اس وقت قومی مفاد کا یہی تقاضا ہوگا، ہمیں اس میں مین میخ نہیں نکالنی چاہیے
826469204895334402,mujibshami1,Tue Jan 31 16:36:28 +0000 2017,ur,برصغیرمیں نان سٹیٹ ایکٹرزبھارت نے1971میں متعارف کروائےجب مکتی باہنی تیارکرکےمشرقی پاکستان میں منظم بغاوت کرائی، مودی خوداس کا اقرارکرچکے ہیں
826120423259664384,mujibshami1,Mon Jan 30 17:30:32 +0000 2017,ur,بہت لوگ پوچھ رہےہیں کہ جماعۃ الدعوۃ نےکچھ غلط نہیں کیا تو پھر اس پر پابندی کیوں؟ عرض ہے کہ قوموں کو مجبوراً کچھ کڑوے گھونٹ بھی پینے پڑتے ہیں
826119443281481728,mujibshami1,Mon Jan 30 17:26:38 +0000 2017,ur,اصولی طورپرتوعمران خان کی بات درست ہےکہ ٹرمپ پاکستانیوں کا امریکہ میں داخلہ بھی بند کردے مگر عملاً اس طرح دنیا سے کٹ کر بھی نہیں رہا جا سکتا
826113046846255104,mujibshami1,Mon Jan 30 17:01:13 +0000 2017,ur,بنیادی بات یہ ہے کہ اب کوئی ایسی کارروائی نہیں ہونی چاہیے جس پر بھارت یہ الزام لگا سکے کہ پاکستان میں رہنے والے کسی شخص نے اس میں حصہ لیا ہے
826112155388895232,mujibshami1,Mon Jan 30 16:57:40 +0000 2017,ur,امید ہےہمارےجماعۃ الدعوۃ کےلوگ نظربندہوتےہیں یاان کی سرگرمیاں محدودہوتی ہیں تووہ اسےوسیع ترقومی مفاد میں قبول کریں گے اوراحتجاج نہیں کریں گے
826110462597140480,mujibshami1,Mon Jan 30 16:50:57 +0000 2017,ur,جہادِ افغانستان کو پوری دنیا نے سپورٹ کیا تھا، اسےدہشت گردی نہیں کہاتھا، آج ویسی ہی تحریک آزادی کشمیر کو دہشت گردی کیسے قرار دیا جا سکتا ہے؟
826109635434258432,mujibshami1,Mon Jan 30 16:47:40 +0000 2017,ur,ماضی میں لشکرطیبہ کشمیر میں سرگرم رہی مگر کشمیر کی جدوجہدآزادی کو دہشت گردی نہیں کہا جا سکتا، عالمی طاقتیں بھی اس کو تسلیم کرتی ہیں
826108882443501569,mujibshami1,Mon Jan 30 16:44:40 +0000 2017,ur,آج جماعۃ الدعوۃ پرپابندی لگائےجانےکاامکان ہے، ایک بات توطےہےکہ اس نےپاکستان کےاندر کبھی کوئی تخریب کاری کی نہ تخریب کاروں کی حوصلہ افزائی کی
825598075678892033,mujibshami1,Sun Jan 29 06:54:54 +0000 2017,ur,دھونس جمانےکانام قانون کی حاکمیت نہیں، عدالت سےبھی گزارش ہےکہ وہ فریقین پرڈسپلن نافذکرے، یہ دھماچوکڑی انصاف کےتقاضوں کوپامال کرنےکےمترادف ہے
825597506050473984,mujibshami1,Sun Jan 29 06:52:38 +0000 2017,ur,حکومت اور اپوزیشن کو اگر اپنا اپنا سچ منوانا تھا تو عدالت جانے کی کیا ضرورت تھی؟ براہ کرم جذبات کو ٹھنڈا رکھیےاورجوکچھ کہنا ہےعدالت میں کہیے
825597000183853056,mujibshami1,Sun Jan 29 06:50:38 +0000 2017,ur,گزشتہ دنوں قومی اسمبلی میں اپوزیشن اورحکومت نےایک دوسرےکا منہ کالا کیا، دونوں میں سےکسی کوشاباش نہیں دی جا سکتی کہ دونوں ہی نہلے پر دہلا ہیں
825596556766220288,mujibshami1,Sun Jan 29 06:48:52 +0000 2017,ur,پانامہ کیس پر فریقین اور کچھ اینکر اپنی خواہشات کو قوم کی خواہشات بنا کر پیش کر رہے ہیں، نوبت گالم گلوچ سے مارکٹائی تک آ پہنچی ہے
825595291776720896,mujibshami1,Sun Jan 29 06:43:51 +0000 2017,ur,عدالت پہنچ کربھی فریقین کوقرارنہیں آیا،شیخ رشیدعدالت سےتابوت اوران کےحریف بریت کےمژدے سنا رہے ہیں،کئی اینکرکبھی جج اورکبھی وکیل بنےنظرآتےہیں
825593704492724224,mujibshami1,Sun Jan 29 06:37:32 +0000 2017,ur,پانامہ کامعاملہ جب سپریم کورٹ پہنچا توخیال تھا کہ اب فریقین کوقرارآ جائےگا لیکن انہوں نے تو عدلیہ کے احاطے میں ہی اپنی اپنی مچان لگا رکھی ہے
825590737655980032,mujibshami1,Sun Jan 29 06:25:45 +0000 2017,ur,"""پانامہ دھما چوکڑی""
میرا آج کا کالم ملاحظہ فرمائیں
https://t.co/l7a9x3ndQ0"
824667898295750656,mujibshami1,Thu Jan 26 17:18:43 +0000 2017,ur,اکرام اللہ نیازی کاہاتھ بہت کھلاتھا، بےنواؤں کی مددکرنےوالےتھے،لاہورمیں اس حوالےسےان کی شہرت تھی، کئی مساجد، مذہبی ادارےان کےعطیات سےچلتےتھے
824666451235794944,mujibshami1,Thu Jan 26 17:12:58 +0000 2017,ur,عمران خان کےوالداکرام اللہ نیازی کےخلاف بھی سوشل میڈیاپرمہم چلائی جارہی ہےحالانکہ وہ بڑےبااصول اورایماندارشخص تھے، میری اچھی دوستی تھی ان سے
824665513494253569,mujibshami1,Thu Jan 26 17:09:14 +0000 2017,ur,آج جومعاملہ کریداجارہاہےیہ سارا تب کا ہےجب میاں شریف خودکاروبارچلا رہےتھےاوربھٹوحکومت نےاس پرقبضہ کرلیاتھا،اصل کہانی تومیاں شریف ہی جانتےہیں
824309776918183936,mujibshami1,Wed Jan 25 17:35:40 +0000 2017,ur,امریکہ نےپہلےتو لیبیا، شام، عراق اور دیگر ملکوں کا بیڑہ غرق کرکے پناہ گزین پیدا کیے، اب ڈونلڈٹرمپ ان کے امریکہ آنے پر پابندی لگانے جا رہا ہے
824308746331492352,mujibshami1,Wed Jan 25 17:31:34 +0000 2017,ur,عدالت کےباہر لگنے والی عدالتوں کوروکناسپریم کورٹ کاکام ہے، وہ بھی ہلکی سی تنبیہہ کرکےخاموش ہوجاتی ہے، چلیں! میڈیا کوتومزیدارخبریں مل رہی ہیں
824308067240181763,mujibshami1,Wed Jan 25 17:28:52 +0000 2017,ur,ہمارے کچھ بھائی بند پانامہ کیس کے ایک ایک نقطے پر بحث کر رہے ہوتے ہیں، کچھ عدالت کے لیے بھی چھوڑ دیں، سارا کام آپ ہی نے کرنا ہے!
824305263842836480,mujibshami1,Wed Jan 25 17:17:44 +0000 2017,ur,"2/2 رؤف صدیقی نے درخواست میں کہا ہے کہ ""مجھے بزنس میٹنگ کے لیے بیرون ملک جانا ہے۔"" جو بزنس یہاں کرتے رہے ہیں پہلے اس کا حساب تو دے لیں"
824305179679981571,mujibshami1,Wed Jan 25 17:17:24 +0000 2017,ur,آج رحمان بھولانےرؤف صدیقی کےخلاف بلدیہ فیکڑی کےمالک سے4کروڑروپےلینےکاانکشاف بھی کردیاہےاوررؤف صدیقی نےپاسپورٹ واپس کرنےکی درخواست کردی ہے1/2
824302070631198721,mujibshami1,Wed Jan 25 17:05:03 +0000 2017,ur,الطاف حسین کےخلاف اہم گواہ سرفراز مرچنٹ کہتےرہےہیں کہ پاکستانی اداروں نےبرطانیہ سے بروقت رابطہ نہیں کیا، مقدمات ختم ہونےکی ایک وجہ یہ بھی ہے
824301204398292992,mujibshami1,Wed Jan 25 17:01:36 +0000 2017,ur,وزارت داخلہ نےالطاف حسین پردرج مقدمات ختم کرنےپربرطانوی حکومت کوخط لکھ کرتشویش کااظہارتوکردیاہے،یہاں انکےخلاف تحقیقات مکمل کیوں نہیں ہورہیں؟
823938259797557248,mujibshami1,Tue Jan 24 16:59:23 +0000 2017,ur,پاکستان نےابابیل 1میزائل کاکامیاب تجربہ کیاہےجوہرطرح کےہتھیار2200کلومیٹرتک لیجانےاورکئی اہداف کونشانہ بنانےکی صلاحیت رکھتاہے، قوم کومبارکباد
823932275788312576,mujibshami1,Tue Jan 24 16:35:37 +0000 2017,ur,سوال اٹھایا جا رہا ہےکہ ریٹائرڈ فوجی افسروں کوزمین ملنی چاہیےیانہیں؟ میرےخیال میں یہ زمین موروثی نہیں ہونی چاہیے، یہ 15سے20 سال کےلیےدی جائے
823930205714714624,mujibshami1,Tue Jan 24 16:27:23 +0000 2017,ur,اب جنرل راحیل کوزمین الاٹ کرنےکامعاملہ اچھالاجارہاہے، ان پر دونوں کو غصہ ہے جن کی وہ توقعات پر پورے نہیں اتر اور جنہیں ان سے شکایات رہی ہیں
823591178251751425,mujibshami1,Mon Jan 23 18:00:13 +0000 2017,ur,لاہورسیشن کورٹ میں وکلاگردی کانیامظاہرہ ہواہے، بارکونسل کی ذمہ داری ہےکہ ایسے وکلا کےخلاف کارروائی کرےجنہوں نےعدالتی نظام کو تماشابنایاہواہے
823589176113250305,mujibshami1,Mon Jan 23 17:52:15 +0000 2017,ur,اشتہارات توخیبرپختونخوا حکومت بھی دے رہی ہے اوران میں پرویزخٹک کےساتھ عمران خان کی تصویربھی ہوتی ہے، اشتہارات پر نہیں ان کےمواد پرتنقید کریں
823588235653713920,mujibshami1,Mon Jan 23 17:48:31 +0000 2017,ur,دنیا میں حکومتوں کو ترقیاتی بجٹ کا 5 فیصد تک اشتہارات پر خرچ کرنے کی اجازت ہوتی ہے، یہاں ڈیڑھ فیصد خرچ کیا گیا ہے اوراس پربھی تنقید ہورہی ہے
823587146820882433,mujibshami1,Mon Jan 23 17:44:11 +0000 2017,ur,عمران خان نےحکومت کےاشتہاردینےپرتنقیدکی ہے، اشتہارنہیں ہوں گےتوٹی وی اوراخبار بند ہوجائیں گے، جب میڈیا نہ رہا تو ملک میں جمہوریت کہاں ہو گی؟
823581536859684867,mujibshami1,Mon Jan 23 17:21:54 +0000 2017,ur,سراج الحق اتنی سنجیدگی سےعدالت میں پیش ہورہے ہیں توکوئی ڈھنگ کا وکیل ہی کر لیتے، ان کا وکیل تو اپنا بھی وقت ضائع کر رہا ہے اور دوسروں کا بھی
823580445313007617,mujibshami1,Mon Jan 23 17:17:34 +0000 2017,ur,دنیامیں وزرائےاعظم اپنی بات پارلیمنٹ میں ہی کرتے ہیں،جماعت اسلامی کے وکیل نےتواس پرہی اعتراض کرڈالا، لگتاہےانہوں نےقانون ق سےنہیں ک سےپڑھاہے
823578249800327168,mujibshami1,Mon Jan 23 17:08:50 +0000 2017,ur,پانامہ کیس میں جماعت اسلامی کے وکیل کو میں ذاتی طور پر تو نہیں جانتا لیکن ان کے دلائل سن کر لگتا ہے معاملہ کافی کمزور ہے
823057214432804864,mujibshami1,Sun Jan 22 06:38:26 +0000 2017,ur,امریکہ اپنی عالمی ذمہ داریوں کوبوجھ سمجھ کراٹھانےسےانکار کرے گا تو اس کا اثرورسوخ محدود ہوتا جائےگا اوراس کا آفتاب غروب کا سفر تیز کر دے گا
823056518580936704,mujibshami1,Sun Jan 22 06:35:40 +0000 2017,ur,ڈونلڈ ٹرمپ نےاپنی روش پر برقراررکھی تو خود امریکہ کے لیے خطرہ بنیں گے، چین کی ویٹو پاور کے ہوتے وہ پاکستان کی گردن پر انگوٹھا نہیں رکھ سکتے
823056074307764226,mujibshami1,Sun Jan 22 06:33:54 +0000 2017,ur,ٹرمپ کےآنےسےپاکستان کوپریشان ہونےکی ضرورت نہیں کہ اب امریکی امداد ہمارے لیےاہم نہیں رہی تاہم اسےدشمن بنانا یا سمجھنا ہمارےمفاد میں نہیں ہوگا
823053805663227905,mujibshami1,Sun Jan 22 06:24:53 +0000 2017,ur,"""امریکی غروب کا آغاز؟""
میرا آج کا کالم ملاحظہ فرمائیں
https://t.co/YWNXr7G7VL"
822139359222710272,mujibshami1,Thu Jan 19 17:51:12 +0000 2017,ur,سیاستدان کب تک ایک دوسرےکےکپڑےاتاریں گے؟ جوباہرہیں ان سےالیکشن تک صبرنہیں ہورہا اورجوحکومت میں ہیں وہ مخالفین کےجواب میں خاموش نہیں رہ پارہے
822136465056497664,mujibshami1,Thu Jan 19 17:39:42 +0000 2017,ur,ایک بریفنگ میں بتایاگیاکہ یہاں عطیات جمع کرکےبیرون ملک مذہبی رہنماؤں کوبھجوائےجاتےہیں، پھروہی رقم واپس آتی ہےلیکن اس کا کوئی ریکارڈنہیں ہوتا
822133464577228802,mujibshami1,Thu Jan 19 17:27:47 +0000 2017,ur,رپورٹس آ رہی ہیں کہ ہمارےکالجوں اورسکولوں میں منشیات فروخت ہورہی ہیں، لگتا ہےہم نے اپنے ہاں ہر طرح کی لاقانونیت رائج کرنے کا تہیہ کر رکھا ہے
822132860782055426,mujibshami1,Thu Jan 19 17:25:23 +0000 2017,ur,غیرملکی خفیہ ایجنسیوں کی فنڈنگ پکڑنے کا ایک ہی طریقہ ہے کہ ملک میں ٹیکس کے قوانین کماحقہ لاگو ہوں اورہرشخص کی آمدنی اور اخراجات کا ریکارڈ ہو
822131933626957825,mujibshami1,Thu Jan 19 17:21:42 +0000 2017,ur,کوئی شک نہیں کہ پاکستان کی بدامنی میں بیرونی خفیہ ایجنسیوں کی فنڈنگ ملوث ہے اور یہ 100فیصد روکی نہیں جا سکتی، امریکہ جیسا ملک اس سے قاصر ہے
821759046357319680,mujibshami1,Wed Jan 18 16:39:58 +0000 2017,ur,کل پیپلزپارٹی بھی ریلی نکال رہی ہے، ہمارے سیاستدانوں کا خیال ہے کہ وہ قوم کو ہیجانی کیفیت میں رکھ کر کوئی بڑی کامیابی حاصل کر سکتے ہیں
821756519243022337,mujibshami1,Wed Jan 18 16:29:56 +0000 2017,ur,عدالت میں مقدمے سے زیادہ مقدمے بازی عوام میں ہو رہی ہے، جس طرح کی زبان استعمال ہو رہی ہےقابل افسوس ہے، سیاستدانوں کو ہوش کے ناخن لینے چاہئیں
821752434620071936,mujibshami1,Wed Jan 18 16:13:42 +0000 2017,ur,امریکی کہتےہیں عافیہ نےفوجیوں پرحملہ کیاجوناقابل معافی ہے،ہم اس کہانی کونہیں مانتےمگراس سےیہ سبق ضرورلیناچاہیےکہ فوجیوں پرحملہ کتنابڑاجرم ہے
821751599676747776,mujibshami1,Wed Jan 18 16:10:23 +0000 2017,ur,اوباما نےڈاکٹرعافیہ کورہانہیں کیاتوہمیں ہمت نہیں ہارنی چاہیے،ٹرمپ کوباورکراناچاہیےکہ وہ یہ کام کردیں توپاکستان میں ان کی عزت کتنی بڑھ جائےگی
821749777981390848,mujibshami1,Wed Jan 18 16:03:09 +0000 2017,ur,پاکستانی حکومت نےکوشش تو کی، ڈاکٹر عافیہ کےبدلےشکیل آفریدی کوچھوڑنے کی پشکش بھی کی مگر اوباما نےچیلسی میننگ کی سزاتومعاف کردی، عافیہ کی نہیں
821747948748963840,mujibshami1,Wed Jan 18 15:55:52 +0000 2017,ur,ڈاکٹر عافیہ کو امریکی فوجیوں پر ایک ایسے ہتھیار سے حملہ کرنے کی کوشش کے الزام میں 86 سال قید کی سزا دی گئی جسے شاید وہ اٹھا بھی نہ سکتی ہوں
819229623615684608,mujibshami1,Wed Jan 11 17:08:57 +0000 2017,ur,لوگوں کا لاپتہ ہونا افسوسناک ہے، وزیراعظم اور وزیرداخلہ کو نوٹس لینا چاہیے، اگر انہوں نے کوئی جرم کیا ہے تو سامنے لا کران پرمقدمہ چلایا جائے
819229067555860480,mujibshami1,Wed Jan 11 17:06:44 +0000 2017,ur,امریکی میڈیاکوڈونلڈ ٹرمپ ہضم نہیں ہورہے، اب انکشاف کردیاگیا ہےکہ روس کےپاس ان کےمتعلق قابل اعتراض مواد ہےجس کے ذریعے وہ بلیک میل ہو سکتے ہیں
819227613726130177,mujibshami1,Wed Jan 11 17:00:58 +0000 2017,ur,امریکی میڈیا نے تاحال ڈونلڈ ٹرمپ کا پیچھا نہیں چھوڑا، لگتا ہے امریکہ میں بھی وہی دھینگا مشتی ہونے جا رہی ہے جو پاکستان میں ہوتی ہے
819221948454629377,mujibshami1,Wed Jan 11 16:38:27 +0000 2017,ur,گورنر سندھ سعید الزماں صدیقی کے انتقال کی خبر سن کر بہت صدمہ ہوا، بہت زیرک انسان تھے، اللہ تعالیٰ ان کی مغفرت فرمائے اور لواحقین کو صبر دے
818881833844834305,mujibshami1,Tue Jan 10 18:06:57 +0000 2017,ur,سرسیدکوانگریزی نہیں آتی تھی،انہوں نےانگریزی پڑھنےکوکہا، قائداعظم اردوسےنابلدتھےمگراسےقومی زبان بنایا، دوراندیش لیڈریوں قوموں کی تعمیرکرتےہیں
818880094429184000,mujibshami1,Tue Jan 10 18:00:03 +0000 2017,ur,اکتوبر2017 میں سرسیداحمدخان کی200 ویں سالگرہ منائی جائےگی، اسےسرسید کاسال قراردیناچاہیےاور تعلیم پرتوجہ دینی چاہیےجوان کی تعلیمات کاخاصا تھی
818878592146931713,mujibshami1,Tue Jan 10 17:54:05 +0000 2017,ur,فوجی عدالتوں کے لیے آئینی ترمیم پر نیا اتفاق رائے آسان نہیں ہو گا، حکومت کو اس کے لیے سخت کوشش کرنی پڑے گی، اب یہ کام ٹھنڈے پیٹوں نہیں ہو گا
818875637209374720,mujibshami1,Tue Jan 10 17:42:20 +0000 2017,ur,پاکستان اسلامی اتحاد میں شامل نہیں ہوتا توان 42 مسلم ممالک سےکٹ کےرہ جائےگا جو اس میں شامل ہیں، ہمیں آگےبڑھنےپرغورکرنا چاہیے پیچھےہٹنےپرنہیں
818874713472696321,mujibshami1,Tue Jan 10 17:38:40 +0000 2017,ur,کل عرض کیا تھا کہ جنرل راحیل شریف حکومت کی رضامندی کے بغیر اسلامی اتحاد کی سربراہی کسی طور قبول نہیں کریں گے، آج اس بات کی تصدیق بھی ہو گئی
818870662001520644,mujibshami1,Tue Jan 10 17:22:34 +0000 2017,ur,اسلامی فوجی اتحاد کےمعاملےپرہمارےکچھ تجزیہ کارفرقہ وارانہ تعصب کا شکارہیں، انہیں اس سوچ سے اوپراٹھناچاہیے، یہ اتحاد کسی فرقے کے خلاف نہیں ہے
818508640600592384,mujibshami1,Mon Jan 09 17:24:01 +0000 2017,ur,سعودی عرب اورایران کا کوئی سرحد یاعلاقے کی ملکیت کا تنازع نہیں ہے، ان کاجھگڑا آسانی سےختم ہو سکتا ہے، پاکستان کو اس میں کردار ادا کرنا چاہیے
818507725021843456,mujibshami1,Mon Jan 09 17:20:23 +0000 2017,ur,نیٹواتحادبن سکتاہےتواسلامی اتحادکیوں نہیں؟یہ کسی ملک یامسلک کےخلاف نہیں،کئی شیعہ ملک بھی اس میں ہیں،ایران اورعراق بھی بعدمیں شامل ہوجائیں گے
