id,user,created_at,lang,full_text
1102088519697252352,mujibshami1,Sun Mar 03 06:09:13 +0000 2019,ur,"’’صندوق"" اور ’’بندوق‘‘ کے سامنے
آج کا کالم پڑھنے کے لیے اس لنک پر جائیں
https://t.co/N9VzHSDgYm"
1101155722136567811,mujibshami1,Thu Feb 28 16:22:37 +0000 2019,ur,کچھ لوگ کہہ رہےتھےکہ بھارتی پائلٹ کونوکری کےبہانےنیپال بلاکراغواکیےگئےکرنل(ر)حبیب کے بدلے رہا کیا جائے، بعض مبصرین کاخیال تھاکہ جذبہ خیرسگالی کےتحت پائلٹ کورہاکردیناچاہیے۔ بہرحال وزیراعظم نےفیصلہ کردیاہے۔ توقع رکھنی چاہیےکہ بھارت بھی کرنل حبیب سےمتعلق کوئی خیرسگالی کا مظاہرہ کردے
1100803609741148162,mujibshami1,Wed Feb 27 17:03:27 +0000 2019,ur,سکوارڈن لیڈر حسن، جنہوں نے بھارتی طیارہ مار گرایا، ان کی تصویر بھی سوشل میڈیا پر گردش کر رہی ہے اور ویڈیو بھی کہ جب وہ واپس آئے تو کس طرح نعرۂ تکبیر کے ساتھ ان کا استقبال کیا گیا، وطن کے اس سپوت کو ہم سلام پیش کرتے ہیں
1100791887575859202,mujibshami1,Wed Feb 27 16:16:52 +0000 2019,ur,جو آج ہوا یہ اپنی نوعیت کا منفرد واقعہ ہے۔ پاک فوج بھارت کی سرزمین پر نہیں گئی، اس کی فضائی حدود کی خلاف ورزی نہیں کی، کوئی جارحیت نہیں کی۔ بھارتیوں کی مت ماری گئی اور وہ آج بھی جارحیت کرنےآگئے۔ ایسا لگتا ہےکچھ تائید غیبی ہمارے شاملِ حال رہی۔ اس پر ہمیں اللہ کا شکر ادا کرنا چاہیے
1100445865532100608,mujibshami1,Tue Feb 26 17:21:54 +0000 2019,ur,معاملہ بہت سنگین ہو چکا، وزیراعظم عمران خان، شہبازشریف اورآصف زرداری سمیت تمام قومی قیادت کو مل بیٹھنا چاہیے۔ نوازشریف کو بھی پیرول پررہا کرکے اس مشاورت میں شریک کرنا چاہیے تاکہ بھرپور پیغام دیا جا سکے کہ قومی سلامتی کےمعاملے پرہم سب متحد ہیں، باقی ساری باتیں بعد میں ہوتی رہیں گی
1100440766592286721,mujibshami1,Tue Feb 26 17:01:38 +0000 2019,ur,بھارتی جارحیت سےایک مشکل صورتحال پیداہوگئی ہے، جب قوموں کےوقاراورانا کا مسئلہ پیدا ہوجاتا ہے تو پھرجواب دینا پڑتا ہے۔ پاکستان کو بھی کچھ نہ کچھ کرنا پڑے گا، خواہ بعد میں جو بھی صورتحال پیدا ہو۔ بالکل مونچھ نیچی کرکے گزارا نہیں ہو سکتا۔ بہرحال اچھی طرح سوچ سمجھ کر اقدام کرنا چاہیے
1100070714248450048,mujibshami1,Mon Feb 25 16:31:11 +0000 2019,ur,آج نوازشریف کی درخواست مسترد ہونےپربھی کچھ سیاستدان ڈیل اورڈھیل کا تذکرہ کیےبغیر نہیں رہ سکے۔ اول توسیاستدانوں کوعدالتی معاملات پرتبصرہ کرتےاحتیاط کرنی چاہیے، اگریہ ایسانہیں کرتے تو عدالتوں کواپنی طاقت بروئےکارلانی چاہیے۔ فیصلہ کسی کےحق میں ہو یا خلاف، چارہ جوئی قانونی ہونی چاہیے
1100070166900232194,mujibshami1,Mon Feb 25 16:29:00 +0000 2019,ur,نواز شریف دل کے مریض ہیں اور اس پر جیل کا ماحول، ایک شخص جو تین بار وزیراعظم رہا ہے اس کے اعصاب کتنے ہی آہنی کیوں نہ ہوں ان پر ایک دباؤ ہو گا، باقی بیماریوں کے برعکس دل کا معاملہ بہت نازک ہوتا ہے جو چند لمحات میں خراب ہو سکتا ہے اور جیل میں ہونے کے باعث امداد میں تاخیر ہو سکتی ہے
1099560104481964032,mujibshami1,Sun Feb 24 06:42:12 +0000 2019,ur,"آج کا کالم ""رسوائی کا سامان"" پڑھنے کے لیے اس لنک پر جائیں
https://t.co/fLzcyQXWjJ"
1098638571110625281,mujibshami1,Thu Feb 21 17:40:21 +0000 2019,ur,"سپیکرسندھ اسمبلی کو اسلام آباد سے گرفتار کرنے پر نیب نے توجیح پیش کی ہے کہ کراچی میں ان کے ساتھ مسلح گارڈز ہوتے ہیں چنانچہ وہاں گرفتاری سے نقصِ امن کا خطرہ تھا۔
پھر آج کراچی میں ان کےگھرپرچھاپہ کیسےمارلیا گیا؟ یہ کام کرنے والوں کو سوچنا چاہیے، وہ وفاق پاکستان کو نقصان پہنچارہےہیں"
1098637862185123840,mujibshami1,Thu Feb 21 17:37:32 +0000 2019,ur,"آج عالمی عدالت میں بھارتی وکیل نےنوازشریف کےایک انٹرویو کاحوالہ دیا۔ نوازشریف کی وہ گفتگو پسندیدگی کےقابل نہیں تھی،انہیں اس طرح گول مول لفظوں میں بات نہیں کرنی چاہیےتھی
بہرحال بھارتی وکیل نےیہ نقطہ اٹھایاہےتوہمیں اس پربحث میں پڑکراس معاملے پرموجود قومی اتحاد داؤ پرنہیں لگاناچاہیے"
1098269180049190914,mujibshami1,Wed Feb 20 17:12:32 +0000 2019,ur,نیب کےلیے قواعدوضوابط بنانابہت ضروری ہے، ہوناتو یہ چاہیےکہ متعین الزام ہو، ایف آئی آردرج ہو اور پھر ملزم کےخلاف کارروائی کی جائے۔ آج جو کچھ ہورہا ہےاس کےذمہ دارآصف زرداری اورنوازشریف دونوں ہیں، دونوں نے ایک دوسرے کو نیچا دکھانے کے لیے باہم تعاون نہیں کیا اور اب دونوں بھگت رہے ہیں
1098265673556520964,mujibshami1,Wed Feb 20 16:58:36 +0000 2019,ur,ایک اسمبلی سپیکرکی گرفتاری کےگہرےسیاسی اثرات مرتب ہوں گے اوراسےایک افسوسناک خبرکےطور پر یادرکھاجائےگا۔ سندھ وفاق پاکستان کااہم جزو ہےجس کااپناایک طرزِسیاست ہے۔ اس صوبےکی اسمبلی کےسپیکرکو اسلام آباد سےگرفتارنہیں کیا جانا چاہیےتھا، اگرناگزیر ہی تھا تو یہ کارروائی کراچی میں کی جاتی
1097899686126600192,mujibshami1,Tue Feb 19 16:44:17 +0000 2019,ur,"وزیراعظم عمران خان نےکہاہےکہ بھارت پلوامہ حملےکی جس طرح کی تحقیقات کرانا چاہتا ہے ہم تیارہیں۔
اس سےبڑی توکوئی پیشکش نہیں ہوسکتی، اب بھارت سرکارپرلازم ہے وہ واضح کرے کہ کس طرح کی تحقیقات چاہتی ہے، جنگ کسی مسئلے کا حل نہیں، بھارت یاد رکھے کہ پاکستان کوئی تر نوالہ نہیں ہے"
1097542990053150720,mujibshami1,Mon Feb 18 17:06:54 +0000 2019,ur,سعودی ولی عہد کے انتہائی اہم دورۂ پاکستان سے پہلے مقبوضہ کشمیر اور ایران میں بیک وقت دو ایسی وارداتیں ہو جائیں جن سے بھارت کو پاکستان کے خلاف بولنے کا موقع ملے، کیا یہ محض اتفاق ہے؟ ایسا لگتا ہے کوئی اور طاقت ایسی ہے جو اس پر کام کر رہی ہے
1097542733588250625,mujibshami1,Mon Feb 18 17:05:53 +0000 2019,ur,عمران خان ایسی شخصیت ہیں جن سے عالمی رہنما ملنا چاہتے ہیں، انہیں پلوامہ جیسے واقعات پر بھارتی پراپیگنڈے کا جواب دینےکےلیےاپنی شخصیت کےاس سحر کا فائدہ اٹھانا چاہیے۔ انہیں چاہیے کہ امریکہ، برطانیہ اور یورپ کے دورے کریں اور انہیں باور کرائیں کہ بھارت بغیر ثبوت الزامات عائد کر رہا ہے
1097537444285726721,mujibshami1,Mon Feb 18 16:44:52 +0000 2019,ur,"یونیورسٹی آف مینجمنٹ سائنسز کے سربراہ ابراہیم حسن مراد سے بات ہوئی۔ وہ سعودی ولی عہد کو دیئے گئے عشائیےمیں موجود تھے۔ بتا رہے تھے کہ ان کی میز پر ایک سینئر سعودی ایڈیٹر بیٹھے تھے جنہوں نے کہا کہ ""شہزادہ محمد جتنےخوش یہاں آ کرہوئے ہیں میں نےاتنا خوش انہیں کسی دورےمیں نہیں دیکھا1/2"
1097016855628312576,mujibshami1,Sun Feb 17 06:16:14 +0000 2019,ur,"پاک، سعودی ’’پارٹنر شپ‘‘
آج کا کالم پڑھنے کے لیے اس لنک پر جائیں
https://t.co/wNjQQnQArB"
1096093315802558471,mujibshami1,Thu Feb 14 17:06:25 +0000 2019,ur,میمو گیٹ پر جب کمیشن بن گیا اور اس کی رپورٹ آ گئی تو اس پر کارروائی ریاست نے کرنی ہے عدالت نے نہیں۔ آج معزز عدالت نے بھی یہی کچھ کہا کہ حکومت اگر کچھ کرنا چاہتی ہے تو مقدمہ درج کرائے، عدالت کا یہ کام نہیں ہے، اسی سے آپ اندازہ لگائیے کہ تبدیلی آ چکی ہے
1096091474012319744,mujibshami1,Thu Feb 14 16:59:06 +0000 2019,ur,"میموگیٹ سکینڈل بالآخرانجام کوپہنچا، یہ تھا ہی ایک تماشا، بہرحال حسین حقانی صاحب نےسکون کاسانس لیا ہوگا اگرچہ وہ سمجھتےتھےکہ میں ان کی پہنچ سےدورہوں
حسین حقانی کی ذہانت اورصلاحیت پاکستان کےکام آتی تو بہتر تھا۔ اب بھی ہمارے اداروں کو غور کرنا چاہیے اور انہیں واپسی کاراستہ دیناچاہیے"
1096088946264678405,mujibshami1,Thu Feb 14 16:49:03 +0000 2019,ur,18ویں ترمیم میں صوبوں کو تو اختیارات منتقل کر دیئے گئے لیکن صوبوں سے نچلی سطح پر اختیارات کی منتقلی کوآئینی شکل نہیں دی گئی۔ نتیجہ یہ ہےکہ صوبےسانپ بن کربیٹھ گئے ہیں اورنیچےاختیارات منتقل نہیں کررہے۔ پھرتعلیم اور دیگر کئی شعبے صوبوں کو دے دئیے گئے جو تقسیم نہیں ہو سکتے تھے1/2
1095736779557224448,mujibshami1,Wed Feb 13 17:29:40 +0000 2019,ur,چیف جسٹس آصف سعیدکھوسہ کےجھوٹےمقدمات اورگواہوں کےخلاف روئیےسےلوگوں میں مسرت کی ایک لہر دوڑی ہےلیکن لاتوں کے بھوت باتوں سےنہیں ماننےوالے۔ دو چارکوکڑی سزا دےکردوسروں کے لیے باعثِ عبرت بنانا ہو گا۔ خودسپریم کورٹ میں لوگوں کےخلاف جھوٹی درخواستیں دی جاتی ہیں اور پگڑیاں اچھالی جاتی ہیں
1095733607929384960,mujibshami1,Wed Feb 13 17:17:04 +0000 2019,ur,حکومت نےسوشل میڈیاکی 'تطہیر'کااعلان کردیا ہے، پہلے تو یہ دیکھا جائے کہ ہماری سیاسی جماعتوں بالخصوص پی ٹی آئی نے الیکشن سے قبل سوشل میڈیا پر کیا اودھم مچایا تھااور پھر باقی جماعتیں بھی اس میں شریک ہو گئیں، انہوں نے سوشل میڈیا پرکیسی نفرت انگیز مہمیں چلائیں اور کتنے جھوٹ بولے 1/2
1095363865402109954,mujibshami1,Tue Feb 12 16:47:51 +0000 2019,ur,اپنا لڑکپن یاد آتا ہے، وہ بھی کیا وقت تھا کہ دوسرے ملکوں کے لوگ مدد کے لیے پاکستان کی طرف دیکھا کرتے تھے۔ سعودی معلم یہاں آیا کرتے اور کسی نہ کسی کی دستاویز حاصل کرتے جس میں تصدیق کی گئی ہوتی تھی کہ ان صاحب کی مدد کریں، یہ وہاں حاجیوں کی بہت خدمت کرتے ہیں۔ ایک دور یہ بھی گزرا ہے
1095362875265347589,mujibshami1,Tue Feb 12 16:43:54 +0000 2019,ur,"پھر بحث شروع ہے کہ سعودی ولی عہد پاکستان کے لیے کیا لے کر آ رہے ہیں، یعنی ہم آئیں گے تو آپ ہمیں کیا دیں گے اور آپ آئیں گے تو ہمارے لیے کیا لائیں گے۔
ہمیں ہر وقت ایسی باتیں ہی نہیں کرنی چاہئیں، کچھ ملکی وقار کا بھی خیال رکھنا چاہیے"
1095360565399207936,mujibshami1,Tue Feb 12 16:34:44 +0000 2019,ur,اطلاع ہےکہ سعودی ولی عہد دورۂ پاکستان کے دوران وزیراعظم ہاؤس میں قیام کریں گے۔ اس سے اندازہ لگایا جا سکتا ہے کہ وزیراعظم ہاؤس کی کتنی ضرورت ہوتی ہے۔ جو لوگ جذباتی ہو کرکہتے ہیں کہ اس میں یونیورسٹی بنا دو انہیں معلوم ہونا چاہیے کہ وزیراعظم ہاؤس کوئی فالتو چیز نہیں، ملک کی ضرورت ہے
1094477720598315008,mujibshami1,Sun Feb 10 06:06:37 +0000 2019,ur,"آج کا کالم ""اپوزیشن کی اپوزیشن"" پڑھنے کے لیے اس لنک پر جائیں
https://t.co/gL9BW9LKOh"
1091955752959385601,mujibshami1,Sun Feb 03 07:05:13 +0000 2019,ur,"آج کا کالم ""عدالت میں سیاست"" پڑھنے کے لیے اس لنک پر جائیں
https://t.co/ktmtSoZwju"
1091032970058711040,mujibshami1,Thu Jan 31 17:58:25 +0000 2019,ur,"سانحہ ساہیوال کے گرفتار اہلکاروں نے بیان دیا ہے کہ گاڑی کے ساتھ ایک موٹرسائیکل پر دو افراد سوار تھے جو 'ملزمان' کے ساتھی تھے۔ ان موٹرسائیکل سواروں نے فائرنگ کی جس سے گاڑی کے اندر موجود ان کے ساتھی مرے۔
ان اہلکاروں سے مؤدبانہ گزارش ہے کہ کہانی ایسی گھڑیں جس پر لوگوں کو ہنسی نہ آئے"
1091028110223572992,mujibshami1,Thu Jan 31 17:39:06 +0000 2019,ur,شیخ رشید کی سیاست میں عمر گزر گئی اور رانا ثنا اللہ بھی کل کے بچے نہیں ہیں۔ ایک دوسرے کے نہلے پہ دہلا مارتے رہتے ہیں، کبھی کوئی ایسی بات بھی کر لیا کریں جسے سن کر لوگ خوش ہوں تو کیا مضائقہ ہے۔ ویسے ریسرچ ہونی چاہیے کہ ان میں سے پہل کون کرتا ہے اور اس کاجواب کون دیتا ہے
1091026471416676354,mujibshami1,Thu Jan 31 17:32:35 +0000 2019,ur,شہبازشریف کےپبلک اکاؤنٹس کمیٹی کاچیئرمین بننے پرپی ٹی آئی کا یہ اعتراض درست تھا کہ ن لیگی دور کے منصوبوں کا آڈٹ ان کی سربراہی میں کیسےہوگا۔ ن لیگ نےیہ کہہ کران کا اعتراض دورکر دیا کہ جس اجلاس میں ن لیگی دور کا کیس آئے گا اس کی صدارت شہباز شریف نہیں کریں گے۔ اب اعتراض کا کیا جواز؟
1090659979214897152,mujibshami1,Wed Jan 30 17:16:17 +0000 2019,ur,عمران خان کےوالداکرام اللہ نیازی کےساتھ بہت قریبی تعلق رہا، یہ بات سوفیصدغلط ہےکہ انہیں کرپشن کی بنیاد پرذوالفقاربھٹونےنکالا،انہوں نے1959میں ایوب خان کےدورمیں نوکری چھوڑدی تھی۔ بے پرکی اڑانےوالےکچھ خداخوفی کریں، سیاسی اختلاف اپنی جگہ مگرمخالفین کےوالدین پرتہمتیں نہیں لگانی چاہئیں
1090656234427088896,mujibshami1,Wed Jan 30 17:01:24 +0000 2019,ur,چھوٹی جماعتیں کم نشستوں کے باوجود بہت اہم ہوتی ہیں کہ حکومت کی اکثریت انہی کی وجہ سے ہوتی ہے۔ اختلاف بھی ہو توچھوٹی جماعتیں آسانی سےحکومت نہیں چھوڑتیں کیونکہ حکومت چھوڑیں گی تو بے وزن ہوجائیں گی۔ اخترمینگل کی پارٹی ہویا ق لیگ، اندررہ کرہی دباؤبڑھائیں گی اوراپناایجنڈا پورا کریں گی
1090294167283081217,mujibshami1,Tue Jan 29 17:02:40 +0000 2019,ur,پیپلزپارٹی کو تحفظات لاحق ہیں کہ حکومت 18ویں ترمیم کا خاتمہ کرنااورصدارتی نظام لانا چاہتی ہے حالانکہ حکومت کے پاس دو تہائی اکثریت نہیں ہے اور وہ یہ کام کر ہی نہیں سکتی مگر بلاول بھٹو اس پر لانگ مارچ کرنا چاہتے ہیں، بہرحال جو معاملات عدالتوں میں ہیں وہ توعدالتوں میں ہی طے ہونے ہیں
1089932626260049920,mujibshami1,Mon Jan 28 17:06:02 +0000 2019,ur,جنوبی پنجاب صوبہ پی ٹی آئی کےمنشورکاحصہ تھالیکن اسمبلی میں قرارداد ن لیگ نےپیش کردی ہے۔ اب  پی ٹی آئی کاامتحان ہوگا، یہ صوبےکاکمبل اسےآسانی سےنہیں چھوڑےگا، ویسےعمران خان کہہ چکےہیں کہ بڑالیڈریوٹرن تولیتاہے، وہ کہہ سکتےہیں کہ وزیراعلیٰ جنوبی پنجاب سےمقررکردیالہٰذا محرومی ختم ہوگئی
1089922484810469376,mujibshami1,Mon Jan 28 16:25:44 +0000 2019,ur,سانحہ ساہیوال کی پوسٹ مارٹم رپورٹ آ گئی ہے، پتاچلاہے کہ زندہ بچ جانے والی معصوم بچی کا ہاتھ، جوکہا جارہاتھا کہ شیشےسےزخمی ہوا، وہ بھی گولی سےزخمی ہواتھا۔ لگتاہےجیسےکوئی جنگل تھا اور اس میں درندے انسانوں کا شکار کررہےتھے۔ جتنا اس واقعے پرغورکریں اتنا غصے میں اضافہ ہوتا چلا جاتا ہے
1089403748567388160,mujibshami1,Sun Jan 27 06:04:28 +0000 2019,ur,"آج کا کالم ""ساہیوال کی واردات"" پڑھنے کے لیے اس لنک پر جائیں
https://t.co/VPlhxMzjJz"
1088127673518489600,mujibshami1,Wed Jan 23 17:33:48 +0000 2019,ur,شہبازشریف نےسانحہ ساہیوال پروزیراعظم اوروزیراعلیٰ کےاستعفےکامطالبہ کیاہے۔ اگرساںحہ ماڈل ٹاؤن پر شہباز شریف اور نوازشریف مستعفی ہوجاتےتو آج ان کےمطالبےمیں بڑا وزن ہوتا۔ تب انہوں نے کہاتھا کہ ادارے اپنا کام کریں، اب کوئی نیا سیاستدان، کوئی آج کاعمران خان یہ مطالبہ کرلے تو کرسکتا ہے
1087397191474393088,mujibshami1,Mon Jan 21 17:11:07 +0000 2019,ur,ساہیوال کا سانحہ جب سے ہوا ہے دل میں ایک آگ سی لگی ہوئی ہے، کسی کل چین نہیں آ رہا، اس طرح تو دہشت گردوں کو بھی نہیں مارا جا سکتا جب انہیں روک لیا گیا ہو اور زندہ پکڑا جا سکتا ہو، کچھ سمجھ نہیں آ رہی کہ یہ کیسےہو گیا۔ گاڑی میں بچوں کی موجودگی بھی گولیاں چلانے والوں کونہیں روک سکی؟
1086877103621095425,mujibshami1,Sun Jan 20 06:44:29 +0000 2019,ur,"سپریم کورٹ کا ’’سوو موٹو‘‘ اختیار
آج کا کالم پڑھنے کے لیے اس لنک پر جائیں
https://t.co/2m82Ls4aUI"
1085955002131234818,mujibshami1,Thu Jan 17 17:40:23 +0000 2019,ur,ہماری حکومت کو یقین ہی نہیں آرہاکہ وہ حکومت ہے، وہ تواپوزیشن کا سارویہ اپنائےہوئےہے، ہروقت ایک ہنگامہ برپاہوتاہے۔ اب ای سی ایل کےمعاملےپرہی وزیراعظم کابیان دیکھ لیجیے۔ یہ کسی کےباہرجانے یا نہ جانےکا نہیں انسانی حقوق کامعاملہ ہے، ہرپاکستانی کاحق ہےوہ جب چاہے باہرجائے، چاہے نہ جائے
1085946778501955585,mujibshami1,Thu Jan 17 17:07:42 +0000 2019,ur,ڈیم فنڈ کےلیےاب تک 9ارب روپےاکٹھےہوئےہیں اوراس کی الیکٹرانک میڈیا نےاعزازی طورپرجو تشہیری مہم چلائی اس کی لاگت 13 ارب روپے بنتی ہے۔ اس سے معلوم ہوتا ہے لوگ بھی یہ چاہتے ہیں کہ سپریم کورٹ اپنےمقدمات کی طرف توجہ دے۔ اس طرح کےکاموں کے لیے حکم جاری کرے، نہ کہ خود یہ کام شروع نہ کردے
1085940642402963456,mujibshami1,Thu Jan 17 16:43:19 +0000 2019,ur,"جسٹس آصف سعیدکھوسہ نےفل کورٹ ریفرنس میں جوکچھ کہا اس سے معلوم ہوتاہےکہ ان کاعہد چیف جسٹس ثاقب نثارکےعہد سےبالکل مختلف ہوگا، انہوں نےکہا کہ ""جہاں کوئی اور مداوا نہ ہوا وہاں سوموٹو نوٹس لیا جائے گا۔ پہلے بھی وہ کہہ چکے ہیں کہ وہ جعلی گواہوں اور مقدمات کی تاخیر کے خلاف ڈیم بنائیں گے"
1085594729679671301,mujibshami1,Wed Jan 16 17:48:47 +0000 2019,ur,"اختر مینگل بنیادی طور پر اپوزیشن کے آدمی ہیں

عمر ساری تو کٹی عشقِ بتاں میں مومنؔ
آخری وقت میں کیا خاک مسلماں ہوں گے

ان کا دل توکرتا ہےجا کراپوزیشن میں بیٹھ جائیں کہ حکومت وعدےپورےنہیں کررہی، حکومت کوچاہیے کہ بے اعتنائی چھوڑدےاوراختر مینگل کا دل نہ دکھائےورنہ وہ بھی دُکھاسکتےہیں"
1085239642969042945,mujibshami1,Tue Jan 15 18:17:48 +0000 2019,ur,تحریک انصاف اگرسندھ حکومت کی تبدیلی کاہنگامہ کرتی ہےتومرکزاورپنجاب میں اس کی اپنی حکومتیں سندھ کی نسبت زیادہ دباؤمیں آجائیں گی کیونکہ یہ دونوں چندووٹوں کی اکثریت سےقائم ہیں، حکومت کوچاہیے ذراصبرکرےاورمعاملات کوغیرفطری موڑنہ دے۔ پی پی رہنماؤں کامعاملہ نیب کےپاس ہے اسے ہی نمٹنے دیں
1085229826015924224,mujibshami1,Tue Jan 15 17:38:47 +0000 2019,ur,اگر کسی پر کرپشن کا الزام ہے تو نیب اور دوسرے ادارے ہیں، وہ تحقیقات کریں، حکومت کو بار بار طعنے دینے کی ضرورت نہیں ہے۔ جہاں تک این آر او کی بات ہے تو وہ یہ حکومت دے سکتی ہے نہ اپوزیشن اس سے لے سکتی ہے، حکومت ایسی باتوں سے جتنا ماحول دھندلا کرے گی اتنی اس کی اپنی مشکلات بڑھیں گی
1085224745199636481,mujibshami1,Tue Jan 15 17:18:36 +0000 2019,ur,اپوزیشن کے اسمبلی اجلاس سے واک آؤٹ بارےعمران خان کی یہ بات درست ہےکہ اپوزیشن کا کام ہے وہ ہاؤس کے اندر بیٹھے، اگرچہ اپوزیشن لیڈرکےطورپرعمران خان کی جماعت نےکوئی اچھی مثال قائم نہیں کی تھی۔ دھرنے ہوتے رہے اوراسمبلی کا طویل بائیکاٹ رہا، تاہم کسی بری مثال کی پیروی نہیں کی جانی چاہیے
1084858533504520192,mujibshami1,Mon Jan 14 17:03:24 +0000 2019,ur,نواز شریف کی سزا معطلی کے خلاف نیب کی اپیل خارج ہونا احسن فیصلہ ہے۔ نواز شریف جیل میں ہیں اور مسلسل عدالت میں پیش بھی ہو رہے ہیں۔ ایسے میں سپریم کورٹ مداخلت کرتی تو اس سے ایک منفی تاثر جاتا اور نیب کے فیصلے کے خلاف اپیل کی پوری سماعت متاثر ہو سکتی تھی جو ابھی شروع ہونی ہے۔
1084854172216934400,mujibshami1,Mon Jan 14 16:46:04 +0000 2019,ur,دوست ممالک سے ملنے والے قرض بارے شہباز شریف اور آصف زرداری کے بیانات واقعاتی طور پر درست بھی ہوں تو ہمیں اس طرح اپنے ملک کو خانوں میں تقسیم نہیں کرنا چاہیے۔ قرض آرمی چیف کی وجہ سے بھی ملے اور اس سے معیشت کو فائدہ پہنچے تو اس کا کریڈٹ حکومت، فوج اور پورے پاکستان کو جائے گا
1084337609667739654,mujibshami1,Sun Jan 13 06:33:26 +0000 2019,ur,"آج کا کالم ’’اللہ کا سپاہی‘‘ پڑھنے کے لیے اس لنک پر جائیں
https://t.co/2SYVpCeZj4"
1083420955240812544,mujibshami1,Thu Jan 10 17:50:59 +0000 2019,ur,"بھارتی کرکٹ ٹیم کوآسٹریلیا میں ٹیسٹ سیریزجیتنےپر وزیراعظم عمران خان نے مبارکباد دی تو کچھ لوگوں نے بہت اعتراض کیا کہ مبارکباد کیوں دی اور لفظ 'برصغیر' استعمال کیوں کیا۔
وزیراعظم مودی کا نام ہندوستان نہیں ہے، وہاں ہر پانچواں آدمی مسلمان ہے یعنی ہمارے جسم کا ایک حصہ وہاں رہتا ہے1/2"
